"Yoshikawa, Hirokazu — 2024 — Does adding parent education and workforce training to Head Start promote or interfere…",,United States,"Tulsa, Oklahoma; CareerAdvance + Head Start",37.09,-95.71,yes (3 years),Quasi-experimental (matched comparison),36,quantitative,intervention,CareerAdvance (parent education/training) + Head Start,Yes (matched comparison),no,,,147 CareerAdvance + 139 comparison children (n=286; M=3.6 yrs; 47% female),Yes,,Yes (parents),Yes,,"286 children (Tulsa, 2011–2018): 147 in CareerAdvance (parent training + Head Start) and 139 matched comparison; M age 3.6, 47% female, racially diverse",Yes,,Yes,Yes,Yes,Yes (inhibitory control),,,,,,,,,,,,,,,,,,yes (see abstract),,,,,,,,,,,,,,,"Quasi-experimental study (147 CareerAdvance + 139 matched comparison children; n=286; M age 3.6, 47% female; 3 years). The effect of adding parent education/workforce training (CareerAdvance) to Head Start on children's academic, language, math and inhibitory-control outcomes was neither greater nor less than Head Start alone. | Subgroup: among low-parent-education families the treatment effect was nonsignificant though positive (β=.309, SE=0.387, p=.431) — children's developmental outcomes did not worsen or improve in the short term when parents returned to school.",,,Yes,,,,,,,,,,,,,,,,,,,,,,,,,,,,,,,No,No,"Quasi-experimental study of whether adding parent education/workforce training (CareerAdvance) to Head Start helps or harms children's academic, language, math, and inhibitory-control outcomes over 3 years (147 CareerAdvance vs 139 matched comparison children). The effect of CareerAdvance on child outcomes was neither greater nor less than Head Start alone—children's developmental outcomes did not worsen or improve in the short term when parents returned to school.",,Yes,"Yoshikawa, Hirokazu",New York University Steinhardt,"Terri J. Sabol, Elise Chor, Teresa Eckrich Sommer, Lauren A. Tighe, P. Lindsay Chase‐Lansdale, Amanda Sheffield Morris, Jeanne Brooks‐Gunn, Hirokazu Yoshikawa, Christopher T. King",2024,Child Development,https://doi.org/10.1111/cdev.14141,https://onlinelibrary.wiley.com/doi/pdfdirect/10.1111/cdev.14141,https://openalex.org/W4401178358,4,"This study explores the effects of the two-generation program CareerAdvance-which combines education and training for parents in healthcare with Head Start for children-on children's academic, language, mathematics, and inhibitory control followed for 3 years. The sample (collected in Tulsa, Oklahoma from 2011 to 2018) includes 147 children in the CareerAdvance group and 139 children in a matched comparison group (n = 286; 40% Black, 17%, White, 10% Hispanic, 33% Mixed Race, or Other Race; M = 3.6 years old; 47% female). Overall, the effect of CareerAdvance on child outcomes is neither greater nor less than Head Start alone. These findings suggest that children's developmental outcomes do not worsen or improve in the short term when their parents return to school."
"Yoshikawa, Hirokazu — 2024 — Effects on Maternal Bandwidth of Monthly Unconditional Cash Starting at Birth Among U.S.…",,United States,Baby's First Years RCT,37.09,-95.71,yes (48 months),Randomized controlled trial (Baby’s First Years; preregistered ITT),48,quantitative,intervention,Monthly unconditional cash transfer ($333/mo vs $20/mo),Yes ($20/mo),yes,,,828 low-income U.S. mothers,,,Yes,Yes,,"828 low-income U.S. mothers (Baby’s First Years RCT), 48 months after childbirth",,,,,,,,,,,,,,,,,Yes (maternal cognitive bandwidth),,,,,,,economic,,,,,,,,,,,,,,,"Baby's First Years RCT (N=828; preregistered intent-to-treat, wave-4 maternal MEFS analytic sample). NO differences in low-income US mothers' cognitive bandwidth after receiving a high-cash ($333/month) vs low-cash ($20/month) gift for 48 months after childbirth — contrary to scarcity-theory predictions.",,,Yes,,,,,,,,,,,,,,,,,,,,,,,,,,,,,,,No,No,Baby's First Years RCT (N=828): preregistered intent-to-treat analyses found NO differences in low-income U.S. mothers' cognitive bandwidth after receiving a high-cash ($333/month) vs low-cash ($20/month) gift for 48 months post-childbirth—contrary to scarcity theory predictions.,,Yes,"Yoshikawa, Hirokazu",New York University Steinhardt,"Shannon Dailey, Lisa A. Gennetian, Greg J. Duncan, Nathan A. Fox, Katherine Magnuson, Kimberly G. Noble, Hirokazu Yoshikawa",2024,SSRN Electronic Journal,10.2139/ssrn.4940902,http://dx.doi.org/10.2139/ssrn.4940902,https://openalex.org/W4402090271,0,"Financial scarcity has been posited to reduce adults’ cognitive bandwidth, but causal evidence is thin, especially in the U.S. and for parents of young children. We examine the impact of a monthly unconditional cash transfer on the cognitive bandwidth of U.S. mothers with low income (N=828). Preregistered intent-to-treat analyses find no differences in cognitive bandwidth of mothers after receiving a high-cash gift ($333/month) versus a low-cash gift ($20/month) for 48 months after childbirth."
"Yoshikawa, Hirokazu — 2024 — The developmental consequences of early exposure to climate change-related risks",,Global,,,,no,Conceptual framework (bioecological & dynamic systems),,quantitative,review,,,not applicable,,,n/a (conceptual framework),Yes,,,,,Conceptual framework on prenatal/early-life exposure to acute and chronic climate-change-related risks,,,,,,,,,Yes,,,,,,,,,,,,,,,,,,,,,,,,,,,,,,"Conceptual framework (no statistics; bioecological & dynamic-systems perspectives). Presents a framework for how the distinctive dual time frame of acute (extreme weather events) and chronic (ecological degradation) climate-change risks, experienced prenatally and early in life across ecological contexts, can threaten human development. | Calls on developmental researchers, practitioners and policymakers to address the climate crisis's developmental consequences.",,,,,,,,,,,,,,,,,,,,,,,,,,,,,,,,,,No,Yes (bioecological/dynamic-systems framework),"Conceptual framework (bioecological and dynamic-systems) for how the distinctive dual time frame of acute (extreme weather events) and chronic (ecological degradation) climate-change risks, experienced prenatally and early in life across ecological contexts, can threaten human development. Calls on researchers, practitioners, and policymakers to address the climate crisis's developmental consequences.",,No,"Yoshikawa, Hirokazu",New York University Steinhardt,"Jorge Cuartas, Dana Charles McCoy, Isabella Torres, Lindsey Burghardt, Jack P. Shonkoff, Hirokazu Yoshikawa",2024,Child Development Perspectives,https://doi.org/10.1111/cdep.12503,,https://openalex.org/W4392058380,17,"Abstract The climate crisis encompasses a constellation of risks that threaten human livelihoods, well-being, and survival globally. In this article, we present a new framework based on bioecological and dynamic systems perspectives, and on evidence for conceptualizing how the distinctive dual time frame of both acute (e.g., extreme weather events) and chronic (e.g., ecological degradation) climate change-related risks experienced prenatally and early in life across multiple ecological contexts can threaten human development. We conclude with a call to developmental researchers, practitioners, and policymakers to invest more efforts in understanding and addressing the climate crisis and its developmental consequences to ensure a sustainable future for all."
"Yoshikawa, Hirokazu — 2024 — The effect of unconditional cash transfers on maternal assessments of children’s early…",,United States,Baby's First Years RCT (registered report),37.09,-95.71,yes (to age 3),Randomized controlled trial (registered report),36,quantitative,intervention,Monthly unconditional cash transfer ($333/mo vs $20/mo),Yes ($20/mo),yes,,,"1,000 mothers (maternal reports at ages 1,2,3)",Yes,,Yes,Yes,,"1,000 racially/ethnically diverse U.S. mothers in poverty (Baby’s First Years); maternal reports of child development at ages 1, 2, 3",,,,,Yes (language),,,Yes (socioemotional; developmental delay),,,,,,,,,,,,,,,,economic,,,,,,,,,,,,,,,"Baby's First Years registered report (1,000 racially/ethnically diverse US mothers in poverty; 40% high-cash n=400 / 60% low-cash n=600; maternal reports at ages 1, 2, 3). NO statistically detectable impacts of the high-cash gift ($333 vs $20/month) on maternal reports of children's early language and socioemotional development, concerns for developmental delay, or enrollment in early-intervention services across ages 1–3.",,,Yes,,Yes,,,,,,,,,,,,,,,,,,,,,,,,,,,,,No,No,"Baby's First Years RCT registered report: NO statistically detectable impacts of the high-cash gift ($333 vs $20/month) on maternal reports of children's early language and socioemotional development, concerns for developmental delay, or early-intervention enrollment, across ages 1–3.",,Yes,"Yoshikawa, Hirokazu",New York University Steinhardt,"Emma R. Hart, Lisa A. Gennetian, Jessica F. Sperber, Renata Penalva, Katherine Magnuson, Greg J. Duncan, Sarah Halpern‐Meekin, Hirokazu Yoshikawa, Nathan A. Fox, Kimberly G. Noble",2024,Developmental Psychology,https://doi.org/10.1037/dev0001824,https://doi.org/10.1037/dev0001824,https://openalex.org/W4401760009,12,"Economic disadvantage has often been associated with poorer performance on measures of early childhood development. However, the causal impacts of income on child development remain unclear. The present study uses data from the Baby's First Years randomized control trial to identify the causal impact of unconditional cash transfers on maternal reports of early childhood development. One thousand racially and ethnically diverse mothers residing in poverty were recruited from four U.S. metropolitan areas shortly after giving birth. Mothers were randomized to receive either a $333/month or $20/month unconditional cash transfer for the first several years of their child's life. Maternal reports of language and socioemotional development, concerns for developmental delay, and enrollment in early intervention services were collected annually at the time of the child's first, second, and third birthdays. In this registered report, we document no statistically detectable impacts of the high-cash gift on maternal reports of child development. We discuss the significance and implications of these findings. (PsycInfo Database Record (c) 2024 APA, all rights reserved)."
"Yoshikawa, Hirokazu — 2024 — The Impact of Monthly Unconditional Cash on Food Security, Spending, and Consumption:…",,United States,"Baby's First Years; 12 hospitals, 4 US communities",37.09,-95.71,yes (3 years),Randomized controlled trial (research brief),36,quantitative,intervention,Monthly unconditional cash transfer ($333/mo vs $20/mo),Yes ($20/mo),yes,,,"1,000 mothers near/below poverty line and their newborns",Yes,,Yes,Yes,,"1,000 mothers with incomes at/near the federal poverty line and their newborns (Baby’s First Years; recruited 2018–19 from 12 hospitals in 4 U.S. communities)",,,,,,,,,,,,,Yes (food security/nutrition),,,,,,,,,,,"economic (food security, spending, consumption)",,,,,,,,,,,,,,,"Research brief (descriptive; Baby's First Years, $333 vs $20/month; 1,000 mothers near/below poverty + newborns, recruited 2018–19 from 12 hospitals in 4 US communities). Reports three-year follow-up findings on food security, household spending and consumption, situating cash transfers alongside SNAP and WIC in reducing child poverty and hunger and supporting child development (noting persistent inequities such as food deserts).",,,Yes,,,,,,,,,,,,,,,,,,,,,,,,,,,,,,,No,No,"Baby's First Years research brief on the impact of monthly unconditional cash ($333 vs $20/month) on food security, household spending, and consumption at the 3-year follow-up, situating cash transfers alongside SNAP/WIC in reducing child poverty and hunger and supporting child development.",,Yes,"Yoshikawa, Hirokazu",New York University Steinhardt,"Lisa A. Gennetian, Matthew Maury, Laura Stilwell, Hema Shah, Katherine Magnuson, Kimberly G. Noble, Greg J. Duncan, Nathan A. Fox, Sarah Halpern‐Meekin, Hirokazu Yoshikawa",2024,SSRN Electronic Journal,10.2139/ssrn.4781670,https://doi.org/10.2139/ssrn.4781670,https://openalex.org/W4393647078,2,"Baby’s First Years (BFY) is a randomized control study identifying the causal impact of a poverty-reduction intervention (monthly unconditional cash, $333 vs $20) on early childhood development. One thousand mothers with incomes at or near the federal poverty line and their newborns were recruited from 12 hospitals in four diverse U.S. communities in 2018–2019. This brief reports three-year follow-up findings on food security, spending, and consumption, situating cash transfers alongside SNAP and WIC in reducing child poverty and hunger and supporting child development."
"Yoshikawa, Hirokazu — 2024 — Unconditional Cash and Breastfeeding, Child Care, and Maternal Employment among Families…",,United States,Baby's First Years RCT (first year of life),37.09,-95.71,yes (first year),Randomized controlled trial (Baby’s First Years),12,quantitative,intervention,Monthly unconditional cash transfer ($333/mo vs $20/mo),Yes ($20/mo),yes,,,"1,000 low-income U.S. mothers",Yes,,Yes,Yes,,low-income; parents,,,,,,,,,,,,,Yes (breastfeeding),,,,,,,,,,,"economic (childcare, maternal employment)",,,,,,,,,,,,,,,"Baby's First Years RCT (1,000 low-income US mothers, infant's first year). The likelihood and length of breastfeeding, use of nonparental child care, and maternal employment did NOT statistically differ between high- ($333) and low-cash ($20) groups. | However, the higher gift DELAYED the starting age of child care by almost 1 month (low-cash infants entered home-/center-based care 1 month sooner, p<.01) and increased mothers' ability to meet their birth-stated breastfeeding intentions; the high-cash effect in New York differed statistically from other sites (p<.10).",,,Yes,,,,,,,,,,,,,,,,,,,,,,,,,,,,,,,No,No,"Baby's First Years RCT (1,000 low-income U.S. mothers): likelihood/length of breastfeeding, nonparental childcare use, and maternal employment did NOT differ between high- ($333) and low-cash ($20) groups in the infant's first year. However, the higher gift DELAYED the start of childcare by ~1 month and increased mothers' ability to meet their birth-stated breastfeeding intentions.",,Yes,"Yoshikawa, Hirokazu",New York University Steinhardt,"Laura Stilwell, Maritza Morales-Gracia, Katherine Magnuson, Lisa A. Gennetian, Maria Sauval, Nathan A. Fox, Sarah Halpern‐Meekin, Hirokazu Yoshikawa, Kimberly G. Noble",2024,Social Service Review,https://doi.org/10.1086/729364,https://pmc.ncbi.nlm.nih.gov/articles/PMC11323047/pdf/nihms-2004550.pdf,https://openalex.org/W4398194297,11,"Poverty interferes with parents' breastfeeding, child-care, and employment options and ability to meet their parenting goals. This study-the first randomized controlled trial of early childhood poverty reduction in the United States-investigates how increased economic resources affect 1,000 low-income US mothers' breastfeeding, child-care, and employment practices and the ability to meet their intentions for these practices in the first year of their infant's life. The likelihood and length of breastfeeding, use of nonparental child care, and maternal employment did not statistically differ among mothers who received a high ($333) or low ($20) monthly unconditional cash gift. The higher monthly cash gift, however, delayed the starting age of child care by almost 1 month and increased mothers' ability to meet their breastfeeding intentions reported at birth."
"Yoshikawa, Hirokazu — 2025 — Cash Transfers and Their Effect on Maternal and Young Children’s Health",,United States,"Baby's First Years RCT; 12 hospitals, 4 cities",37.09,-95.71,yes (4 years),Randomized controlled trial (Baby’s First Years),48,quantitative,intervention,Monthly unconditional cash transfer ($333/mo vs $20/mo),Yes ($20/mo),yes,,,"1,000 mother–infant dyads (data from 891 at year 4)",Yes,,Yes,Yes,,low-income; mothers,,,,,,,,,Yes,Yes,,,Yes (child & maternal BMI; child health),,,,"Yes (maternal depression, anxiety)",,,,,,,economic,,,,,,,,,,,,,,,"Baby's First Years RCT after 4 years of monthly cash ($333 vs $20; data from 891 of 1,000 dyads; mean maternal age 27.0). NO statistically detectable group differences in maternal depressive symptoms (ES=0.04, 95% CI −0.08 to 0.17, p=.51), anxiety (ES=0.12, p=.09), or BMI (ES=−0.06, p=.42), nor in child BMI percentile or maternal-reported child health. | Designed to detect an effect size of ~0.20 SD after expected 20% attrition.",,,Yes,,Yes,,,,,,,,,,,,,,,,,,,,,,,,,,,,,No,No,"Baby's First Years RCT after 4 years of monthly cash ($333 vs $20): NO statistically detectable group differences in maternal depressive symptoms (ES 0.04), anxiety (ES 0.12), or BMI (ES −0.06), nor in child BMI percentile or maternal-reported child health (data from 891 dyads).",,Yes,"Yoshikawa, Hirokazu",New York University Steinhardt,"Greg J. Duncan, Katherine Magnuson, Alicia Kunin‐Batson, Hirokazu Yoshikawa, Nathan A. Fox, Sarah Halpern‐Meekin, Nicholas J. Ainsworth, Sarah R. Black, Jennifer Nelson, Timothy D. Nelson, Michael Georgieff, Debra S. Karhson, Lisa A. Gennetian, Kimberly G. Noble",2025,JAMA Pediatrics,https://doi.org/10.1001/jamapediatrics.2025.1612,https://jamanetwork.com/journals/jamapediatrics/articlepdf/2834896/jamapediatrics_duncan_2025_oi_250026_1748962171.48097.pdf,https://openalex.org/W4411343763,17,"Importance: Mothers and children in low-income households are more likely to experience worse mental and physical health than those from higher-income households. Objective: To determine the effect of 4 years of monthly unconditional cash transfers on the mental health of mothers with low-income and the physical health of mothers and children. Design, Setting, and Participants: This was a parallel-group, randomized clinical trial conducted from May 2018 to July 2023. Mother-infant dyads were recruited (May 2018-June 2019) from postpartum wards in 12 hospitals in 4 cities: Omaha, Nebraska; Minneapolis/St Paul, Minnesota; New Orleans, Louisiana; and New York, New York. Data were analyzed from September 2023 to February 2025. Interventions: Mothers were randomly assigned to receive either a high-cash gift ($333 per month) or a low-cash gift ($20 per month) on debit cards. The cash gifts continued for the first 6 years of their children's lives. Data analyzed here were collected after 4 years of monthly transfers. Main Outcomes and Measures: Outcomes were preregistered and measured around the child's fourth birthday. Maternal outcomes included depression, anxiety, and body mass index (BMI). Child outcomes included age- and sex-adjusted BMI percentile and maternal report of child health (overall health, times sick in the past year, and presence of chronic health conditions). Results: A total of 1000 mother-infant dyads (mean [SD] maternal age, 27.0 [5.8] years) were included in this study. Among those mothers, 400 were randomly assigned to receive the $333 high-cash gift and 600 received the $20 low-cash gift on debit cards. Data were available from 891 mother-child dyads. No statistically detectable group differences were found in maternal depressive symptoms (effect size [ES], 0.04; 95% CI, -0.08 to 0.17; P =.51), anxiety (ES, 0.12; 95% CI, -0.02 to 0.25; P =.09), or BMI (ES, -0.06; 95% CI, -0.21 to 0.09; P =.42). In addition, there were no statistically detectable"
"Yoshikawa, Hirokazu — 2025 — Cohort profile: a prenatal birth cohort study of intergenerational risk and resilience…",,Bangladesh (Cox’s Bazar),Rohingya refugee & host-community prenatal birth cohort,21.43,92.01,yes (longitudinal from pregnancy),Prenatal birth cohort study (cohort profile),,quantitative,observational,,,not applicable,,,"2,888 pregnant women (80% Rohingya)",,,Yes (mothers),Yes,,"2,888 pregnant Rohingya refugee and host-community women in Cox’s Bazar, Bangladesh, followed from pregnancy",,,,,,,,,Yes,,,,,,,,"Yes (maternal PTSD, anxiety)",,,,,,,intergenerational risk & resilience,,,,,,,,,,,,,,,"Cohort profile (descriptive; first large prenatal birth-cohort study in a refugee context in an LMIC; Cox's Bazar, N=2,888, 80% Rohingya, recruited over 12 months). Rohingya women were substantially less literate, married/had children younger, lived in more crowded/resource-limited households, and had higher rates of clinically significant PTSD and anxiety than host-community women. | A fifth wave (children 6 months) was completed April 2025; the next follow-up is planned at child age 36 months (from March 2026).",,Yes,,,Yes,,,,,,,,,,,,,,,,,,,,,,,,,,,,,No,No,"Cohort profile of the first large prenatal birth-cohort study in a refugee context in an LMIC (Cox's Bazar, Bangladesh; N=2,888, 80% Rohingya). Rohingya women were substantially less literate, married/had children younger, lived in more crowded/resource-limited households, and had higher rates of clinically significant PTSD and anxiety than host-community women. Investigates lifespan health/developmental implications of being born into a protracted humanitarian context; next wave at child age 36 months (from March 2026).",,Yes,"Yoshikawa, Hirokazu",New York University Steinhardt,"Alice J. Wuermli, Mary Caroline Hiott, Elisa Ugarte, M Sajjadur Rahman, Mahbub Elahi, AK Rahim, Goutam Kumar Dutta, Md Shakil Ahamed, Bharati Roy, Reza Mostary Akhter, Eamam Hossain, Duja Michael, Tasnim Kabir Ayrin, Subah Hasneen Haseen, Rayhan Bin Alam",2025,BMJ Open,https://doi.org/10.1136/bmjopen-2025-099052,https://bmjopen.bmj.com/content/bmjopen/15/11/e099052.full.pdf,https://openalex.org/W4415872122,2,"PURPOSE: As of 2024, 123.2 million people had been forcibly displaced as a result of persecution, armed conflict or climate-related catastrophes, and these numbers are predicted to rise. There is a growing awareness of possible intergenerational effects of trauma on life-course health and well-being, however few studies have followed individuals longitudinally starting prenatally. This paper describes the first large prenatal birth cohort study in a refugee context in a lower middle-income country. This study aims to investigate the potential lifespan health and developmental implications of being born into a protracted humanitarian context, and what factors can buffer from the adversity posed by conflict and displacement. PARTICIPANTS: We outline our approach of recruiting, consenting and gathering data from pregnant Rohingya refugee and host community women (N=2888; 80% Rohingya) over the course of 12 months in Cox's Bazar, Bangladesh. FINDINGS TO DATE: A fifth wave of data collection, when children were 6 months old, was completed in April 2025. Rohingya women were substantially less literate; were marrying and having children at slightly younger ages, were more likely to live in crowded, resource-limited households and exhibited higher rates of clinically significant post-traumatic stress disorder and anxiety than host community women. FUTURE PLANS: There is a critical need for research in displaced populations in order to elucidate potentially lasting transgenerational impacts of experiencing conflict and displacement trauma, and the prenatal and postnatal factors that support health and development across the life span. The next follow-up is planned when the children turn 36 months of age (starting March 2026)."
