File name,Same sample as,Location,,,,Design,,,,,,,,,,,,,,,,,,,,,,,,,,,,,,,,,,,,,,,,,,,,,,,,,,,,,,,Key findings,,,,,,,,,,,,,,,,,,,,,,,,,,,,,,,,,,Does the study include a figure(s) illustrating the key study findings?,Does the study include an image/graphic/figure of a conceptual framework?,Notes,,Open Access,ECPC member,ECPC affiliation,Authors,Year,Journal,DOI,OA URL,OpenAlex ID,Cited by,Abstract
**BLANK**,,,,,,Longitudinal,,,Observational,,Intervention/Prevention study,,,,,,,,,,,Key demographics,,,,,,,,,,,,,,,,,,,,,,,,,,,,,,,,,,,,,,,** see summary of findings at the beginning of the Discussion section,,,,,,,,,,,,,,,,,,,,,,,,,,,,,,,,,,,"** (e.g., Fig 1 in this paper: https://www.bmj.com/content/371/bmj.m2876)",** add anything noteworthy,,,,,,,,,,,,
**BLANK**,,,,,,"** if yes, indicate time between time points, e.g., in years or months",,,** this means no intervention,,Name of the intervention (or brief descriptive title if name is not available),,,Control group?,Assignment to groups randomized?,,,,,,,"** e.g., age range, average age, proportion of gender/sex; socio-economic status, if described in the text",,,,,,,,,,,,,,,,,,,,,,,,,,,,,,,,,,,,,,,** review the Results section; copy-paste description of key findings,,,,,,,,,,,,,,,,,,,,,,,,,,,,,,,,,,,,,,,,,,,,,,,,
**BLANK**,,-------------- WRITE BELOW THIS LINE ----------------------------- WRITE BELOW THIS LINE ----------------------------- WRITE BELOW THIS LINE ----------------------------- WRITE BELOW THIS LINE ----------------------------- WRITE BELOW THIS LINE ----------------------------- WRITE BELOW THIS LINE ----------------------------- WRITE BELOW THIS LINE ----------------------------- WRITE BELOW THIS LINE ----------------------------- WRITE BELOW THIS LINE ----------------------------- WRITE BELOW THIS LINE ----------------------------- WRITE BELOW THIS LINE ----------------------------- WRITE BELOW THIS LINE ----------------------------- WRITE BELOW THIS LINE ----------------------------- WRITE BELOW THIS LINE ----------------------------- WRITE BELOW THIS LINE ----------------------------- WRITE BELOW THIS LINE ----------------------------- WRITE BELOW THIS LINE ----------------------------- WRITE BELOW THIS LINE ----------------------------- WRITE BELOW THIS LINE ----------------------------- WRITE BELOW THIS LINE ---------------,,,,,,,,,,,,,,,,,,,,,,,,,,,,,,,,,,,,,,,,,,,,,,,,,,,,,,,,,,,,,,,,,,,,,,,,,,,,,,,,,,,,,,,,,,,,,,,,,,,,,,,,,,,
,,Country,Setting/location,latitude,longitude,,design,followup (months),quant_qual,type,,control,randomized,,,sample,age_0_8,age_9_25,adult,caregiver,teacher,,Child outcomes,,,,,,,,,,,,,,,,"Caregiver, family, household level",,,,,,,,,Other adult outcomes,,,,"Teacher-, classroom-, or school-level",,,,,Biomakers,,,,,Psychometrics,Descriptive,Group differences,Associations,,"Differential impact (""moderation"")",Mediation,Intervention impact,,,,,,,,,,,,,,,,,,,,,,,,,,,,,,,,,,,,,,,,
,,,,,,,,,,,,,,,,,,,,,,,Reading,Writing,Mathematics,Cognitive,Language,Executive function,Motor skills,Social emotional development,Mental health problems,Behavioral problems,Internalizing problems,Externalizing problems,Physical health,Victimization,Misc (Split into: individual vs. support vs. adaptive behaviors),// Break //,Mental health and well-being,Social-emotional skills,Victimization,Knowledge,Caregiver behavior and practices - positive/reponsive caregiving,Caregiver behavior and practices - harsh/violent disciplinary practices,"Caregiver dyads or family unit (Co-parenting, paternal engagement, family unity and connectedness, intergenerational congruence, family conflict)",Misc,// BREAK //,Mental health,Victimization,Social-emotional skills,Misc,Instructional practices and process quality,Structural quality,Teacher-child interactions,Teacher mental health,Misc,Neurophysiology,Single-gene polymorphism,Stress reactivity,Misc,,,,,Negative,Positive,,,Child level,,,,,,,,,,,,,Caregiver behavior and practices,,,,,,,Caregiver mental health and well-being,,,Misc,,Psychometrics,,,,,,,,,,,,,,,
,,,,,,,,,,,,,,,,,,,,,,,,,,,,,,,,,,,,,,,,,,,,,,,,,,,,,,,,,,,,,,,,,,,,,Reading,Math,,Language,Attachment relationships,Prosocial protective factors,Attention problems,Externalizing problems,Conduct problems,Functional impairment,Traumatic stress reactions,Internalizing problems,,Violent disciplinary practices,Shared decision making,Household conflict,Family connectedness,Parenting,Parent-child relationship,,Anxiety,,,,,,,,,,,,,,,,,,,,
,,,,,,,,,,,,,,,,,,,,,,,,,,,,,,,,,,,,,,,,,,,,,,,,,,,,,,,,,,,,,,,,,,,,,,Geometry,Addition/subtraction,Vocabulary,,,,,,,,Composite,Depression,,,,,,,,,,,,,,,,,,,,,,,,,,,,
"Aber, Larry — 2024 — Patterns of self-regulation and emotional well-being among Syrian refugee children in…",,Lebanon,Northern & eastern Lebanon (Akkar and Bekaa governorates),33.85,35.90,no,Cross-sectional (latent profile analysis); secondary analysis of 5CSEL/HCT cluster-RCT baseline data,,quantitative,observational,(Secondary analysis of Five-Component SEL / Healing Classroom Tutoring CRCT data),,not applicable (descriptive person-centered analysis),,,"2,132",Yes,Yes,,,,"2,132 Syrian refugee children; 50.3% female; grades 1–7 (M grade=2.95); ~53% in Akkar, rest Bekaa; mean 4.1 years in Lebanon; 94.5% in extreme poverty; refugees/IDPs; aged 5–16 (M=9.24, SD=2.36; 90% aged 6–12)",,,,Yes,,Yes,,Yes,Yes,Yes,Yes,,,,"Self-regulation across 4 domains: cognitive regulation (working memory, inhibitory control), emotional-behavioral regulation, interpersonal regulation; emotional well-being (emotion knowledge, positive/negative affect, internalizing symptoms)",,,,,,,,,,,,,,,,,,,,,,,,"Latent profile analysis of 18 self-regulation & emotional well-being indicators (n=2,132); best-fitting unrestricted 7-profile model (entropy=0.853): Profile 1 Happy & positive (11%), Profile 2 Poorly regulated (9%), Profile 3 Sensitive to interpersonal conflict/otherwise regulated (21%), Profile 4 Troubled in classrooms (13%), Profile 5 Well-regulated/emotionally-adjusted (14%), Profile 6 Moody & frustrated (23%), Profile 7 Teacher's favorites (8%). | Multinomial regression (ref=Profile 5): school-related experiences were the most salient predictors of profile membership — school victimization predicted less-adapted profiles (Moody/frustrated b=1.15, p<.001; Troubled b=1.03; Sensitive b=0.76); higher ASER academic score predicted Teacher's favorites (b=0.99) and lower odds of Poorly regulated (b=-1.50); girls less likely Poorly regulated (b=-0.79), more likely Teacher's favorites (b=1.14). No background characteristics distinguished Profile 5 vs the other well-adjusted group; war violence and family conflict were largely non-significant.",Yes,Yes,Yes,,Yes,,,,,,,,,,,,,,,,,,,,,,,,,,,,,Yes (Figure 1: the seven profiles),No,"Latent profile analysis of 18 self-regulation & emotional well-being indicators identified 7 distinct profiles among 2,132 Syrian refugee children: (1) Happy & positive (11%); (2) Poorly regulated (9%); (3) Sensitive to interpersonal conflict/otherwise regulated (21%); (4) Troubled in classrooms (13%); (5) Well-regulated/emotionally-adjusted (14%); (6) Moody & frustrated (23%); (7) Teacher's favorites (8%). Substantial heterogeneity challenges a homogeneous view of development in conflict settings. Multinomial regression (ref=Profile 5) showed SCHOOL-RELATED experiences were the most salient predictors of profile membership: school victimization predicted less-adapted profiles (Moody/frustrated b=1.15, p<.001; Troubled b=1.03; Sensitive b=0.76); higher ASER academic scores predicted Teacher's favorites (b=0.99) and lower odds of Poorly regulated (b=-1.50); girls were less likely Poorly regulated (b=-0.79) and more likely Teacher's favorites (b=1.14). War violence and family conflict were largely non-significant. Authors advocate tailored, profile-specific interventions.",,Yes,"Aber, Larry",New York University Steinhardt,"J. Lawrence Aber, Ha Yeon Kim, Zezhen Wu",2024,Development and Psychopathology,https://doi.org/10.1017/s0954579424001202,https://www.cambridge.org/core/services/aop-cambridge-core/content/view/3F0E4B1C90E62D3FE586DD0D2DB401BE/S0954579424001202a.pdf/div-class-title-patterns-of-self-regulation-and-emotional-well-being-among-syrian-refugee-children-in-lebanon-an-exploratory-person-centered-approach-div.pdf,https://openalex.org/W4404509195,3,"This study explores patterns of self-regulation and emotional well-being among Syrian refugee children in Lebanon, employing a person-centered approach, responding to theoretical challenges articulated by Dante Cicchetti and other psychologists. Using latent profile analysis with data from 2,132 children, we identified seven distinct profiles across cognitive regulation, emotional-behavioral regulation, interpersonal regulation, and emotional well-being. These profiles showed significant heterogeneity in patterns of self-regulation across domains and emotional well-being among Syrian children. Some profiles consistently exhibited either positive (""Well-regulated and Adjusted"") or negative (""Moody and Frustrated"") functioning across all domains, while others revealed domain-specific challenges, e.g., particularly sensitive to interpersonal conflict. This heterogeneity in the organization of self-regulatory skill and emotional well-being challenges the traditional homogeneous view of child development in conflict settings. The study also underscores the profiles' differential associations with demographic characteristics and experiences, with school-related experiences being particularly salient. We discuss the implications of these findings for future research in developmental psychopathology on self-regulation and emotional well-being in conflict-affected contexts. In addition, we advocate for tailored interventions to meet the diverse needs of children affected by conflict."
"Aber, Larry — 2025 — Improving Classroom Quality and Children’s Learning in Early Childhood Education:…",,Ghana,Greater Accra Region; pre-primary (kindergarten) public & private schools,5.61,-0.21,no,Book chapter / research–practice partnership case study (reviews a cluster-RCT: Quality Preschool for Ghana),,quantitative,intervention,Quality Preschool for Ghana (QP4G): in-service teacher training + parental-awareness program,Yes (3 arms: teacher training; teacher training + parental awareness; control),"yes (cluster; 240 schools, 6 disadvantaged Greater Accra districts)",,,"240 schools; ~3,345 children; ECE teachers & district coordinators (coaches)",Yes,,,,,Pre-primary (kindergarten) children (~age 5); ECE teachers; district ECE coordinators serving as coaches; Ministry of Education/Ghana Education Service partners; 6 most-disadvantaged Greater Accra districts,Yes,,Yes,,,Yes,,Yes,,Yes,,,,,,,,,,Yes (parental awareness/expectations),,,,yes (see abstract),,,,,,Yes,,Yes,"Yes (professional well-being, burnout, turnover)",yes (see abstract),,,,,"Impacts on classroom processes (Emotional Support, Behavior Management, Supporting Student Expression) were moderate (0.5–0.6 SD); impacts on children's academic and social-emotional school-readiness outcomes were small (0.13–0.18 SD), with little evidence of impact heterogeneity by gender or baseline proficiency. | Moderate-sized reductions in teacher burnout and mid-year attrition (much larger in the private sector). | The added parental-awareness intervention rather than enhancing the teacher-training program counter-acted impacts on some dimensions of classroom quality and on ALL child outcomes, including negative impacts on numeracy 2 years later; teacher-training gains were largely sustained one year later, but teachers likely need ongoing support to sustain quality improvement.",,Yes,,,,,,,,,,,,,,,,,,,,,,,,,,,,,,,,Yes (chapter figures),Yes (partnership / theory of change),"Research–practice partnership case study reviewing the Quality Preschool for Ghana (QP4G) cluster-RCT (240 schools; 3 arms). The in-service teacher-training program (an 8-week preservice course condensed to a scalable 5-day in-service format, with district ECE coordinators trained as coaches) significantly improved multiple dimensions of teaching/process quality, teacher knowledge, and professional well-being (reduced burnout and turnover), and improved children's school readiness—notably social-emotional skills; teacher-training impacts were largely sustained one year later. The added parental-awareness program (3 videos shown via Parent–Teacher Association meetings) produced UNEXPECTED counteracting/negative effects on child school-readiness outcomes, concentrated in households with non-literate male heads, posing new research questions. Demonstrates the feasibility and challenges of scaling teacher training through existing government systems via a research–practice partnership.",,No,"Aber, Larry",New York University Steinhardt,"Sharon Wolf, J. Lawrence Aber, Jere R. Behrman, Edward Tsinigo",2025,,https://doi.org/10.1108/978-1-80117-624-820251001,,https://openalex.org/W4412941865,0,"Abstract This chapter critically reviews opportunities and challenges in designing and conducting actionable research on improving preprimary school quality and children’s learning and development, with a case study in Ghana. We describe the development of a research–practice partnership among university-based researchers, a local research organization, and Ghana’s Ministry of Education. The partnership developed and evaluated an in-service teacher training and a parental awareness program. Both programs pursued the same goals of increasing child-centered and play-based learning and improving children’s school readiness. We discuss the successes and challenges of scaling-up a successful teacher in-service training program. In addition, we describe unexpected findings of the parental awareness program that pose several new research questions. Implications for future research on measuring and improving preprimary educational quality through similar research–practice partnerships are discussed."
"Aber, Larry — 2026 — Investigating the bidirectional relationships between social and emotional learning and…",,Lebanon,Bekaa & Akkar regions; non-formal Healing Classroom Tutoring (HCT) education support program,33.85,35.86,yes (within school year; ~17-week interval between waves),Longitudinal (2 waves); secondary analysis of cluster-RCT (HCT treatment sites only),4,quantitative,observational,(Secondary analysis of Healing Classroom Tutoring CRCT data; HCT-only and HCT+SEL treatment sites),,not applicable (analysis uses HCT treatment sites),,,"2,757 students; 131 teachers",Yes,Yes,,,Yes,"2,757 Syrian refugee children (aged 5–16, M=8.98, SD=2.32; 49.7% female) enrolled in HCT in Bekaa & Akkar; 131 locally hired/trained teachers (aged 18–48, M=27.45, 91.2% female); ~17 students per classroom; refugees/IDPs",Yes,,Yes,,,Yes,,Yes,Yes,Yes,Yes,Yes,,,"Academic performance composite (literacy + numeracy); five teacher-reported SEL domains: Working Memory Functioning, Inhibitory Control Functioning, Prosocial Behavior & Social Acceptance, Hyperactivity/Externalizing, Emotional Distress/Internalizing",,,,,,,,,,,,,,,,,Yes (teacher-reported SEL),,yes (see abstract),,,,,"Only Working Memory Functioning predicted academic performance (b=.10, SE=.02, p<.01), above and beyond the other SEL competencies and baseline academic performance. | Increases in academic performance were positively associated with end-of-year Working Memory Functioning (b=.24, SE=.04, p<.001) and negatively associated with end-of-year Emotional Distress & Internalizing Behavior (b=-.11, SE=.04, p<.01). | No other SEL skill (inhibitory control, prosocial behavior, hyperactivity/externalizing) showed bidirectional associations with academics; post-hoc interactions were at most marginal (none met p<.05 except a baseline-academics × initial-hyperactivity term).",,,Yes,Yes,Yes,Yes,,,,,,,,,,,,,,,,,,,,,,,,,,,,Yes,No,"Bidirectional multilevel models (2,757 students, 131 teachers; ~17-week interval) controlling for child, teacher, household-risk and site covariates. Working Memory Functioning uniquely showed RECIPROCAL links with academics: start-of-year teacher-reported WM predicted end-of-year academic performance (b=.10, SE=.02, p<.01), AND start-of-year academic performance predicted end-of-year WM (b=.24, SE=.04, p<.001). No other SEL skill showed bidirectional associations. Start-of-year academic performance also NEGATIVELY predicted end-of-year Emotional Distress/Internalizing (b=-.11, SE=.04, p<.01). Inhibitory control, prosocial behavior, and hyperactivity/externalizing were not bidirectionally linked to academics. Post-hoc moderation: the link between baseline academics and end-of-year hyperactivity/externalizing varied by initial hyperactivity (b=.05, SE=.02, p<.03). Highlights WM's central role and the utility of field-feasible teacher-reported SEL assessment in resource-constrained settings.",,No,"Aber, Larry",New York University Steinhardt,"Abiraahmi Shankar, Ha Yeon Kim, Caroline Tubbs-Dolan, Roxane Caires, J. Lawrence Aber, Mayarí Montes de Oca, Patrick Anker",2026,International Journal of Behavioral Development,https://doi.org/10.1177/01650254261434433,,https://openalex.org/W7160414418,0,"This study investigates bidirectional relationships between Syrian refugee children’s social and emotional learning (SEL) skills and academic performance in an education support program in Lebanon. Using data from a cluster randomized control trial with 2,757 students who completed performance-based academic assessments and reports of their SEL skills from 131 teachers, we examine bidirectional associations between academic and five teacher-observable SEL skills/behaviors: Working Memory Functioning, Inhibitory Control Functioning, Prosocial Behavior, Hyperactivity &amp; Externalizing Behavior, and Emotional Distress &amp; Internalizing Behavior. Controlling for child-, teacher-, household risk-, and site-level covariates, multilevel modeling revealed that Working Memory Functioning uniquely stood apart from other SEL domains: start-of-year teacher-reported Working Memory Functioning predicted end-of-year academic performance, and start-of-year academic performance predicted end-of-year teacher-reported Working Memory Functioning. No other SEL skills demonstrated such bidirectional associations. Start-of-year academic performance also negatively predicted end-of-year teacher-reported Emotional Distress. Findings highlight the distinct and central role of Working Memory Functioning in academic learning, suggesting that easier-to-collect academic performance data may serve as an indicator of SEL skills that may be difficult to assess sans strong teacher–student relationships. Further, they highlight the utility of teacher-reported SEL assessments in resource-constrained contexts, calling attention to bidirectional developmental pathways when supporting children’s holistic well-being."
"Betancourt, Theresa — 2023 — A Tale of Two Programs for Parents of Young Children: Independently-Conducted Case…",,Bhutan; Rwanda,Parenting programs delivered to groups (Bhutan) and via home visits (Rwanda),-1.94,29.87,yes,Implementation research / workforce study (mixed methods); two independently-conducted case studies,,mixed,intervention,"Prescription to Play (Bhutan, Save the Children) and Sugira Muryango (Rwanda, Boston College/Univ. of Rwanda/FXB)",,no,,,Frontline delivery workforce: health assistants (Bhutan) & community volunteers (Rwanda); 10–11 days training,,,,Yes,,"Parents of young children served by two parenting programs; study focus is the delivery workforce (health assistants in Bhutan; volunteers in Rwanda), trained 10–11 days",,,,,,,,,,Yes,,,,,,,,,,Yes (worker knowledge / delivery competence),Yes (positive parenting is the program target),,,parenting practices; workforce/implementation quality,,,,,,,,,,,,,,,"Independent observation rated delivery quality as generally good: overall mean 2.36/3 (Bhutan, n=60) and 2.44/3 (Rwanda, n=60) across 10 active-teaching/learning qualities. | Workers' duty, confidence, and community respect were strong motivators. Scale-up facilitators: institutionalized training and a knowledgeable workforce in Bhutan (barrier: an overworked workforce); strong follow-up supervision in Rwanda (barrier: high attrition among a volunteer workforce).",,Yes,,,,,,,,,,,,,,,,,,,,,,,,,,,,,,,,Yes,No,"Independently-conducted implementation case studies of two parenting programs—Prescription to Play (Bhutan, group-based) and Sugira Muryango (Rwanda, home-visiting)—focused on the delivery workforce. Workers were trained 10–11 days using demonstrations, role plays, and manuals. Duty, confidence, and community respect were strong motivators. Independent observation rated delivery quality as generally good: overall mean 2.36/3 (Bhutan) and 2.44/3 (Rwanda) across 10 items. Facilitators of scale-up in Bhutan = institutionalized training and a knowledgeable workforce (barrier: an overworked workforce); in Rwanda = strong follow-up supervision (barriers: high attrition among a volunteer workforce).",,Yes,"Betancourt, Theresa",Boston College School of Social Work,"Frances E. Aboud, Karma Choden, Michael Tusiimi, Rafael Contreras Gomez, Rachel Hatch, Sara Dang, Theresa S. Betancourt, Karma Dyenka, Grace Umulisa, Carina Omoeva",2023,Children,https://doi.org/10.3390/children10081413,https://www.mdpi.com/2227-9067/10/8/1413/pdf?version=1692436474,https://openalex.org/W4386030601,10,"Two case studies of parenting programs, aiming to improve parenting practices and child development outcomes, and implemented by Save the Children/Ministry of Health/Khesar Gyalpo University in Bhutan and Boston College/University of Rwanda/FXB in Rwanda, respectively called Prescription to Play and Sugira Muryango, were conducted by an independent research and learning group. Implementation research focused on the workforce, a crucial but little-studied element determining the success of programs going to scale. Mixed methods were used to examine their training, workload, challenges, and quality of delivery. Health assistants in Bhutan and volunteers in Rwanda were trained for 10-11 days using demonstrations, role plays, and manuals outlining activities to deliver to groups of parents (Bhutan) or during home visits (Rwanda). Workers' own assessments of their delivery quality, their confidence, and their motivations revealed that duty, confidence, and community respect were strong motivators. According to independent observations, the quality of their delivery was generally good, with an overall mean rating on 10 items of 2.36 (Bhutan) and 2.44 (Rwanda) out of 3. The facilitators of scaling for Bhutan included institutionalizing training and a knowledgeable workforce; the barrier was an overworked workforce. The facilitators of scaling for Rwanda included strong follow-up supervision; the barriers included high attrition among a volunteer workforce."
