"Littman, Jess — 2025 — Remote Facilitation of Essential Newborn Care: A Multinational, Multicenter Pilot Study",,Nigeria; Bangladesh,8 health-care sites (incl. 1 humanitarian setting); remote & in-person facilitation,9.08,8.68,"yes (baseline, post-training, endline)","Prospective educational intervention study (multinational, multicenter pilot)",,quantitative,intervention,Essential Newborn Care (ENC) online course + low-dose high-frequency (LDHF) practice; remote vs in-person facilitation,,no,,,18 in-country facilitators trained 236 frontline health-care workers at 8 sites,,,Yes,,,18 in-country facilitators and 236 frontline health-care workers across 8 sites in Nigeria and Bangladesh (including one humanitarian setting),,,,,,,,,,,,,Yes (neonatal care competencies),,,,,,,,,,,,,,,,,,,,,Yes (health-worker ENC knowledge & bag-mask-ventilation skills),,,,,"Prospective multinational pilot (18 in-country facilitators trained 236 frontline health-care workers at 8 sites in Nigeria & Bangladesh, incl. 1 humanitarian setting; ENC online course + low-dose high-frequency manikin practice; remote vs in-person facilitation). All sites showed significant improvement in pass rates from baseline to post-training on the ENC knowledge check and bag-mask-ventilation skills (e.g., Damaturu, Nigeria: 43% → 100%). | NeoNatalie Live manikin pass rates generally improved from post-training to endline; OSCE A pass rates ranged 48–100% post-training and were largely maintained at endline (44–100%; 1 site declined). Concludes ENC online materials + LDHF practice can augment knowledge/skills and offer a flexible remote or in-person training option.",,Yes,,,,,,Yes,,,,,,,,,,,,,,,,,,,,,,,,,,No,No,"Prospective multinational pilot of Essential Newborn Care (ENC) training using the AAP/Laerdal online platform plus low-dose high-frequency (LDHF) manikin practice. Technical advisors remotely oriented 18 in-country facilitators in Nigeria and Bangladesh, who then trained 236 frontline health-care workers at 8 sites (including one humanitarian setting) via remote or in-person facilitation. All sites showed SIGNIFICANT improvement in pass rates from baseline to post-training on the ENC knowledge check and bag-mask-ventilation skills; NeoNatalie Live manikin pass rates generally improved from post-training to endline, and OSCE pass rates were high and maintained. Concludes ENC online materials + LDHF practice can augment knowledge/skills and offer a flexible remote or in-person training option.",,Yes,"Littman, Jess",,"Monika Patil, Mohammad Abdul Mannan, Bolaji Akala, Maimunat Alex-Adeomi, Rumpa Mani Chowdhury, Sanjoy Kumer Dey, Abubakar Garba Farouk, Maria Ahuoiza Garba, Md Golam Hafiz, Md Golam Mothabbir, Lia Harris, Naji Hattar, Shahidul Hoque, Ismat Jahan, Allison Judkins",2025,Pediatrics Open Science,https://doi.org/10.1542/pedsos.2024-000356,https://publications.aap.org/pediatricsopenscience/article-pdf/doi/10.1542/pedsos.2024-000356/1813613/pedsos_2024000356.pdf,https://openalex.org/W4410837991,1,"BACKGROUND AND OBJECTIVES Essential Newborn Care (ENC) training improves neonatal outcomes, particularly in low-resource settings. The American Academy of Pediatrics and Laerdal Global Health developed an online platform, https://hmbs.org/, to facilitate training of health care workers (HCWs) in ENC. This study aims to examine the impact of training with the ENC course. We hypothesize that training with the ENC course, either with remote or in-person facilitation, and low-dose high-frequency (LDHF) practice improves HCW knowledge and skills. METHODS In this prospective educational intervention study, technical advisors remotely oriented in-country facilitators to ENC in Nigeria and Bangladesh. In-country facilitators then trained frontline HCWs, choosing between a remote or in-person approach based on the country context. ENC knowledge check, bag-mask ventilation (BMV) skills, and NeoNatalie Live (NNL) manikin feedback pass rates were assessed at baseline (BL), immediately posttraining (PT), and endline (EL). Objective structured clinical examination (OSCE) A and B scores were assessed at PT and EL. LDHF practice was implemented at all sites using the NNL manikin. RESULTS After remote orientation, 18 in-country facilitators trained 236 frontline HCWs at 8 sites, including 1 humanitarian setting. All sites showed significant improvement in pass rates from BL to PT in knowledge check and BMV skills. NNL pass rates generally improved from PT to EL. OSCE A and B pass rates were also generally high PT and maintained at EL. CONCLUSIONS ENC online materials coupled with LDHF practice can augment knowledge and skills in ENC and offer a flexible option for remote or in-person training."
"McCarthy, Michael — 2025 — Navigating social and emotional learning evidence in a polarized socio-political…",,United States,,,,no,Qualitative pilot study (policy analysis; SEL stakeholder interviews),,mixed,observational,,,not applicable,,,25 SEL stakeholders,,,Yes,,,"25 SEL stakeholders across professions: K-12 educators, school administrators, district personnel, policymakers, parents, and SEL researchers/advocates (United States)",,,,,,,,Yes,,,,,,,,,,,,,,,,yes (see abstract),,,,,,Yes (SEL evidence use in practice/policy),,Yes,,yes (see abstract),,,,,"Qualitative pilot study (25 SEL stakeholders: K-12 educators, administrators, district staff, policymakers, parents, researchers/advocates; grounded-theory; ≥20-interviewee target). SEL research evidence currently lacks accessibility for policymakers, leaders and practitioners and is hard to translate into practice; stakeholders access evidence diversely, mostly via news and education media. | SEL misinformation/disinformation may be MORE accessible to decision-makers than the supportive evidence, risking exclusionary policies; discusses implications for producing, disseminating and using SEL research amid a polarized US socio-political climate.",,Yes,,,,,,,,,,,,,,,,,,,,,,,,,,,,,,,,No,No,"Qualitative pilot study examining whether and how 25 SEL stakeholders (K-12 educators, administrators, district staff, policymakers, parents, researchers/advocates) understand, access, and use SEL research evidence amid a polarized US socio-political climate that is fueling SEL misinformation/disinformation. Findings: SEL research evidence currently lacks accessibility for policymakers, leaders, and practitioners and is hard to translate into practice; stakeholders access evidence diversely, mostly via news and education media; and SEL misinformation may be more accessible to decision-makers than the supportive evidence. Discusses implications for producing, disseminating, and using SEL research.",,Yes,"McCarthy, Michael",Yale Child Study Center,"Michael F. McCarthy, Eliya Ahmad Herskowitz, Sophie P. Barnes, Zi Jia Ng, Cheyeon Ha, Christina Cipriano",2025,Social and Emotional Learning Research Practice and Policy,https://doi.org/10.1016/j.sel.2025.100170,https://doi.org/10.1016/j.sel.2025.100170,https://openalex.org/W7115703849,2,"An increasingly polarized socio-political climate is diminishing the public's confidence in the SEL research evidence. In some cases, producing misinformation – or false evidence- as well as disinformation – or intentionally false evidence. Both have the potential to contribute to exclusionary policies and inequitable social and emotional experiences for students in the United States. This manuscript explores whether and how SEL stakeholders ( n = 25) understand, access, and use evidence to inform SEL-related decisions across professions, including K-12 educators, school administrators, and district personnel as well as policymakers, parents, and SEL researchers and advocates. Results from this pilot study suggest that SEL research evidence currently lacks accessibility for policymakers, educational leaders, and practitioners, and that the evidence that is available is limited in how it can be translated to and used in practice. How stakeholders identify and use SEL evidence is diverse, and most stakeholders access SEL evidence via news and education media. Opportunities for improving SEL evidence understanding, access, and use in the current U.S. socio-political climate are discussed. Findings suggest that SEL misinformation is likely more accessible to decision makers than the evidence that illustrates the success and benefits of SEL programming. Without continued proof and confirmation about what SEL is and how SEL is benefiting the nation’s youth, false narrative surrounding SEL that is being advocated for by specific groups and politicians is likely to prevail, resulting in continued skepticism about the use of SEL approaches in classrooms. This policy analyses and research study yield significant implications for SEL researchers and other stakeholders interested in creating, disseminating, and using SEL research in practice."
"Miller, Sarah — 2023 — UPDATED PROTOCOL: Universal school‐based programmes for improving social and emotional…",,International,,,,no,Protocol for an evidence and gap map (EGM),,quantitative,review,,,yes,,,n/a (EGM protocol),Yes,Yes,,,,"Universal, school-based SEL programmes for children aged 3–11 years (primary studies, RCTs/cluster RCTs, and systematic reviews)",,,,,,,,Yes,,,,,,,,,,,,,,,,,,,,,,,,,,,,,,,"Protocol (no findings). Sets out the methods for a live, searchable evidence and gap map (EGM) to identify and map all primary studies (including randomized and cluster-randomized trials) and systematic reviews on universal, school-based social and emotional learning programmes for young children aged 3–11 years.",,,,,,,,,,,,,,,,,,,,,,,,,,,,,,,,,,No,No,"Protocol for a live, searchable evidence and gap map (EGM) to identify and map all primary studies (including randomized and cluster-randomized trials) and systematic reviews on universal, school-based social and emotional learning programmes for young children aged 3–11 years.",,Yes,"Miller, Sarah",Queen's University Belfast,"Jennifer Hanratty, Sarah Miller, Leonor Rodríguez, Paul Connolly, Jennifer Roberts, Seaneen Sloan, Aoibheann Brennan‐Wilson, Daragh Bradshaw, Christopher Coughlan, Nicole Gleghorne, Laura Dunne, Sharon Millen, Aimee Smith, Cadhla O’Sullivan",2023,Campbell Systematic Reviews,https://doi.org/10.1002/cl2.1346,https://onlinelibrary.wiley.com/doi/pdfdirect/10.1002/cl2.1346,https://openalex.org/W4385583530,2,"This is the protocol for an evidence and gap map. The objective of this EGM is to identify and map all primary studies (including randomised and cluster randomised trials) and systematic reviews on universal, school-based social and emotional learning programmes for young children (3-11 years) to create a live, searchable, and publicly available evidence and gap map."
"Miller, Sarah — 2025 — Exploring Developmental Outcomes for Children Attending Community-based Pre-Schools in…",,Timor-Leste,Community-based alternative pre-schools (CBAPs) vs public pre-schools (LINKS study),-8.87,125.73,yes (9 months pre-/post-test),Quasi-experimental pre/post-test with public pre-school control group,9,quantitative,intervention,UNICEF community-based alternative pre-schools (CBAPs),Yes (public pre-school),no,,,607 children from 33 pre-schools (508 completed post-tests),Yes,,,,,607 children recruited from 33 pre-schools in Timor-Leste (508 completed post-tests after 9 months); part of the NIHR-funded LINKS study on ECD and social cohesion/peacebuilding in six conflict-affected LMICs,Yes,,Yes,Yes,,,Yes,Yes,,,,,,,"Holistic ECD (East-Asia Pacific Early Childhood Development Scales, EAP-ECDS)",,,,,,,,,,,,,,,,,,,,,,,,"Quasi-experimental pre/post evaluation (LINKS study; 607 children from 33 pre-schools; 508 post-tested after ~9 months — retention 83.7%, control 75.4% / intervention 87.9%; East-Asia Pacific Early Childhood Development Scales). At baseline the public pre-school group significantly out-performed the CBAP group on all EAP-ECDS domains. | Despite differences in time-in-pre-school and infrastructure, CBAP attendance appeared to CLOSE the baseline developmental gap between the two school types — underscoring the importance of pre-school access for children at highest risk of not reaching their developmental potential, and pointing to the need to scale and rigorously (experimentally) evaluate the programme.",,Yes,Yes,,,,,Yes,,,,,,,,,,,,,,,,,,,,,,,,,,No,No,"Quasi-experimental pre/post-test evaluation (LINKS study) of UNICEF community-based alternative pre-schools (CBAPs) vs public pre-schools in Timor-Leste, with 607 children from 33 pre-schools (508 post-tested after ~9 months), assessed with the East-Asia Pacific Early Childhood Development Scales (EAP-ECDS). Despite differences in time-in-pre-school and infrastructure, CBAP attendance appeared to CLOSE the developmental gap seen at baseline between the two school types—underscoring the importance of pre-school access and early learning for children at highest risk of not reaching their developmental potential, and pointing to the need to scale and rigorously (experimentally) evaluate the programme.",,Yes,"Miller, Sarah",Queen's University Belfast,"Laura Dunne, Aoibheann Brennan‐Wilson, Leonardo Ferreira Soares, Dulce Martins da Silva, Antero Benedito Da Silva, Nicole Gleghorne, Sarah Miller, Paul Connolly",2025,Child Care in Practice,https://doi.org/10.1080/13575279.2025.2449852,https://doi.org/10.1080/13575279.2025.2449852,https://openalex.org/W4407097133,2,"There is a substantial body of evidence which indicates that early childhood programmes have a positive effect on children's school readiness, academic achievement, and social and emotional development. Indeed, these benefits can last into adulthood. Based on this evidence base, many countries that strive to build their early childhood education offer to enhance later chances of prosperity. LINKS is an NIHR-funded study, carried out by a team from Queen's University Belfast and Ulster University, with support from UNICEF. The project aims to explore the impact of early childhood development programmes on social cohesion/peacebuilding in six conflict-affected low- and middle-income countries (LMICs); Timor-Leste, Viet Nam, Mali, Egypt, Kyrgyzstan and Tajikistan. This paper will focus on research carried out as part of the LINKS study in Timor-Leste which aimed to evaluate the impact of UNICEF community-based alternative pre-schools (CBAPs) in Timor-Leste. This research, carried out in 2020, employed a quasi-experimental pre- post-test design with a public pre-school control group. A total of 607 children were recruited to participate from 33 pre-schools: 508 completed post-tests after nine months of pre-school exposure to the CBAP programme. The East-Asia Pacific Early Childhood Development Scales (EAP-ECDS) were used to assess the development of children in the current study. Results of the post-test suggest that despite differences in time children spend in pre-school and infrastructure between the school types, attendance at CBAPs appears to close the developmental gap seen at the pre-test (baseline) between children in the two groups. The findings underline the importance of pre-school access and early learning experiences to the development of children at the highest risk of not reaching their developmental potential. The results point to the need to scale the intervention and to carry out an experimental effectiveness evaluation of this promising programme."
"Panter-Brick, Catherine — 2024 — Father Involvement and Child Development: A Prospective Study of Syrian Refugee Families",,Jordan,Syrian refugee families (forced displacement),31.96,35.93,"yes (2 time points, 2021–22)",Prospective longitudinal (father–mother–child triads),,quantitative,observational,,,not applicable,,,160 father–mother–child triads at T1 (105 at T2),Yes,,Yes (fathers & mothers),Yes,,"Syrian refugee families with 4–8-year-old children in Jordan; father–mother–child triads (n=160 at T1, n=105 at T2), 2021–22",,,,,,,,Yes (child SEL),,,,,,,,,Yes (mother mental health),,,,Yes (responsive/involved parenting),,Yes (father involvement; spousal agreement; relationship quality),yes (see abstract),,,,,,,,,,,,,,,"Prospective study (Syrian refugee father–mother–child triads, n=160 T1 / 105 T2; children 4–8). Syrian fathers rated themselves as highly involved — 13% MORE involved than mothers reported them to be (and indicated 17.6% more time with children, ~0.6 more days/week, than mothers reported). Levels of father involvement were largely UNRELATED to child outcomes. | Spousal DISAGREEMENT about father involvement was negatively associated with relationship quality, mother mental health and child social-emotional learning (SEL): in the most discordant families, child SEL was more than 1 SD (43%) below the most concordant families — distinguishing levels of involvement from father–mother agreement.",,,Yes,Yes,,,,,,,,,,,,,,,,,,,,,,,,,,,,,,No,No,"Prospective study of father involvement in Syrian refugee families in Jordan (father–mother–child triads, n=160 T1 / 105 T2; children 4–8). Syrian fathers rated themselves as highly involved—about 13% MORE involved than mothers reported them to be. Levels of father involvement were largely UNRELATED to child outcomes. However, spousal DISAGREEMENT about father involvement was negatively associated with relationship quality, mother mental health, and child social-emotional learning (SEL): in the most discordant families, child SEL was >1 SD (43%) below the most concordant families. Distinguishes levels of father involvement from father–mother agreement, and suggests helping parents negotiate caregiving and responsive parenting.",,No,"Panter-Brick, Catherine",Yale University,"Kristin Hadfield, Majd Al‐Soleiti, Rana Dajani, Isabelle Mareschal, Catherine Panter‐Brick",2024,Journal of Child and Family Studies,https://doi.org/10.1007/s10826-024-02809-y,,https://openalex.org/W4392373983,9,
"Panter-Brick, Catherine — 2024 — Physiological and genomic signatures of war and displacement: A comprehensive literature…",,International (refugees in Europe & the Middle East),,,,no,Comprehensive literature review,,quantitative,review,,,not applicable,,,37 publications reviewed (since 2000),,Yes,Yes,,,Review of biological/biomarker studies among refugee populations (forcibly displaced; many relocated in Europe and the Middle East),,,,,,,,,,,,,,,,,,,,,,,,,,,,,,,,,,,Yes (genomic/epigenetic biomarkers),,Yes (physiological stress biomarkers),Yes (toxic stress / war-related adversity),"Comprehensive review (37 publications since 2000; most refugees relocated in Europe and the Middle East; 24 of 37 studied adults rather than youth/children). Cross-sectional, observational and experimental studies show heterogeneous physiological and genomic (DNA methylation, MAOA, 5-HTT, COMT) responses to war-related adversity and their links to health — e.g., higher BDNF/NGF associated with worse PTSD, depression and anxiety scores when controlling for pre-displacement exposures. | Concludes with four observations: why genomic/physiological biomarkers are valuable; which study designs advance causal/intervention understanding; how to prepare for ethical challenges; and why theoretical frameworks and research procedures need more detailed consideration.",Yes,,,,,,,,,,,,,,,,,,,,,,,,,,,,,,,,,No,Yes (theoretical/ethical framework discussion),"Comprehensive review (37 publications since 2000, mostly refugees relocated in Europe and the Middle East) of physiological and genomic biomarkers of war and forced displacement. Cross-sectional, observational, and experimental studies show HETEROGENEOUS human biological responses to war-related adversity and their links to health. Concludes with four observations: why genomic/physiological biomarkers are valuable; which study designs advance causal/intervention understanding; how to prepare for ethical challenges; and why theoretical frameworks and research procedures need more detailed consideration.",,No,"Panter-Brick, Catherine",Yale University,"Jelena Jankovic‐Rankovic, Catherine Panter‐Brick",2024,Psychoneuroendocrinology,10.1016/j.psyneuen.2024.107084,,https://openalex.org/W4397048680,13,
"Panter-Brick, Catherine — 2025 — A Preliminary Investigation of Associations Between Traumatic Events Experienced During…",,Brazil,"Adolescent mothers in a home-visiting intervention, São Paulo",-23.55,-46.63,no,Observational (multivariable regression of diurnal salivary cortisol),,mixed,observational,,,not applicable,,,23 adolescent mothers and 32 infants (saliva at 12 months postpartum),Yes,,Yes (adolescent mothers),Yes,,"Adolescent mothers (14–19) and their infants in São Paulo, Brazil (saliva from n=23 mothers, n=32 infants at 12 months postpartum); part of the Primeiros Laços home-visiting trial",,,,,,,,,Yes,,,,,Yes,,,Yes (maternal trauma/interpersonal violence history),,,,,,,yes (see abstract),,,,,,,,,,,,,Yes (maternal & infant diurnal salivary cortisol),cortisol,"Multivariable regression of diurnal salivary cortisol among adolescent mothers (14–19) and infants in São Paulo (saliva from n=23 mothers, n=32 infants at 12 months postpartum; adjusting for intervention group, infant sex, maternal age, medication and sample timing). Higher-than-average LIFETIME trauma exposure was associated with maternal EVENING cortisol (b=0.472, p=.028); lifetime assaultive-violence exposure likewise (b=0.196, p=.02); and maternal trauma during PREGNANCY was positively associated with INFANT bedtime cortisol (b=0.21, p=.01). | Trauma variables were not associated with maternal or infant morning cortisol — consistent with fetal-programming models of intergenerational trauma transmission.",,,Yes,,Yes,,,,,,,,,,,,,,,,,,,,,,,,,,,,,No,No,"Investigation of associations between maternal interpersonal-violence/trauma history and maternal & infant diurnal salivary cortisol among adolescent mothers (14–19) and infants in São Paulo, Brazil (n=23 mothers, 32 infants; 12 months postpartum). Adjusting for intervention group, infant sex, maternal age, medication, and sample timing: higher-than-average LIFETIME trauma exposure was associated with maternal EVENING cortisol (b=0.472, p=.028); lifetime assaultive-violence exposure was likewise associated with maternal evening cortisol (b=0.196, p=.02); and maternal trauma exposure during PREGNANCY was positively associated with INFANT bedtime cortisol (b=0.21, p=.01). Consistent with fetal-programming models of intergenerational trauma transmission.",,No,"Panter-Brick, Catherine",Yale University,"Kyle S. Wiley, Gisele Rodrigues Gouveia, Caroline Camilo, Verônica Euclydes, Catherine Panter‐Brick, Alícia Matijasevich, Alexandre Archanjo Ferraro, Lislaine Aparecida Fracolli, Anna Maria Chiesa, Eurı́pedes Constantino Miguel, Guilherme V. Polanczyk, Helena Brentani",2025,American Journal of Human Biology,https://doi.org/10.1002/ajhb.70004,,https://openalex.org/W4407183228,3,"INTRODUCTION: Interpersonal violence against women is a major global health problem that may have intergenerational effects. This study investigated associations between maternal experiences of interpersonal violence and other traumatic events and maternal and infant salivary diurnal cortisol in a cohort of adolescent mothers in São Paulo, Brazil. METHOD: Adolescent mothers (14-19 years) participating in a home-visiting intervention were interviewed retrospectively about lifetime and pregnancy violence and trauma exposure. Mothers collected saliva at waking and before bedtime from themselves (n = 23) and their infants (n = 32) at 12 months postpartum. Multivariable regression models were used to examine associations between trauma history variables and salivary diurnal cortisol. RESULTS: Adjusting for the intervention group, infant sex, maternal age, non-supplement medication use, and sample collection time, we found that higher-than-average lifetime trauma exposure was associated with maternal evening cortisol (b = 0.472, p-value = 0.028). Lifetime assaultive violence exposure was also associated with maternal evening cortisol (b = 0.196, p-value = 0.02). Maternal exposure to traumatic events in pregnancy was positively associated with bedtime cortisol levels of infants (b = 0.21, p = 0.01). Trauma variables were not associated with maternal or infant morning cortisol levels. CONCLUSION: Results suggest that maternal trauma history influences both maternal and infant postnatal cortisol regulation as indexed by evening cortisol levels. These results are consistent with models of fetal programming; however, future studies should investigate potential postnatal psychobiological pathways. Lifetime trauma exposure may also become embedded in the maternal hypothalamic-adrenal-pituitary axis regulation. Future studies are needed to consider other biological pathways in the intergenerational transmission of trauma."
